"Abscess","Abscess: A local accumulation of  pus anywhere in the body."
"Asthma"," Asthma is a chronic inflammation of the bronchial tubes (airways) that causes swelling and narrowing (constriction) of the airways."
"Allergic Reaction","Allergic reaction:  The hypersensitive response of  the immune system of an allergic individual to a substance."
"Arthralgia","Arthralgia: Pain in a joint."
"Arthritis"," Arthritis is a joint disorder featuring inflammation."
"Azotemia","Azotemia: A higher-than-normal blood level of urea or other nitrogen-containing compounds."
"Anemia","*Anemia facts medical author: William C. Shiel Jr., MD, FACP, FACRAnemia is a medical condition in which the red blood cell count or hemoglobin is less than normal."
"Adenopathy","Adenopathy: Large or swollen lymph nodes."
"Anorexia"," Anorexia nervosa, commonly referred to simply as anorexia, is one type of eating disorder."
